[
  {
    "source_id": "federal-register-nrc",
    "last_receipt_id": "federal-register-nrc-20260825175201240-b4c366bce4e6",
    "last_checked_at": "2026-08-25T17:52:01.240Z",
    "check_status": "unchanged",
    "last_success_at": "2026-08-25T17:52:01.240Z",
    "last_success_sha256": "b4c366bce4e6235cd8ba59cd5d3691d4bef6f0a08e0a630d7025163bd6524a71",
    "last_change_at": "2026-08-25T16:42:39.078Z",
    "source_published_at": "2026-08-25T00:00:00.000Z",
    "record_count": 1,
    "consecutive_failures": 0,
    "is_stale": false,
    "stale_since": null,
    "error_class": null,
    "error_message": null
  },
  {
    "source_id": "grants-gov-nuclear",
    "last_receipt_id": "grants-gov-nuclear-20260825175201240-7e88fdeba890",
    "last_checked_at": "2026-08-25T17:52:01.240Z",
    "check_status": "unchanged",
    "last_success_at": "2026-08-25T17:52:01.240Z",
    "last_success_sha256": "7e88fdeba8905f900d8a79f3b768a78d2c46776050645ac14a9dcb0be4c83e82",
    "last_change_at": "2026-08-25T16:41:47.901Z",
    "source_published_at": null,
    "record_count": 50,
    "consecutive_failures": 0,
    "is_stale": false,
    "stale_since": null,
    "error_class": null,
    "error_message": null
  },
  {
    "source_id": "nrc-reactor-status",
    "last_receipt_id": "nrc-reactor-status-20260825175201240-6a4cfd876642",
    "last_checked_at": "2026-08-25T17:52:01.240Z",
    "check_status": "unchanged",
    "last_success_at": "2026-08-25T17:52:01.240Z",
    "last_success_sha256": "6a4cfd8766422b7557fff468647747a6dea6fb3bf1d092707b5672343059f7e2",
    "last_change_at": "2026-08-25T16:42:39.078Z",
    "source_published_at": "2026-08-25T00:00:00.000Z",
    "record_count": 95,
    "consecutive_failures": 0,
    "is_stale": false,
    "stale_since": null,
    "error_class": null,
    "error_message": null
  },
  {
    "source_id": "usaspending-nuclear",
    "last_receipt_id": "usaspending-nuclear-20260825175201240-fc757405485b",
    "last_checked_at": "2026-08-25T17:52:01.240Z",
    "check_status": "unchanged",
    "last_success_at": "2026-08-25T17:52:01.240Z",
    "last_success_sha256": "fc757405485bafe627208795a5010df673f1db91aef27d86e0699fc9879b142a",
    "last_change_at": null,
    "source_published_at": null,
    "record_count": 0,
    "consecutive_failures": 0,
    "is_stale": false,
    "stale_since": null,
    "error_class": null,
    "error_message": null
  }
]
